      AVX2: advanced vector extensions 2       = true
      AVX512CD: conflict detection instrs      = true
      AVX512ER: exponent & reciprocal instrs   = true
      AVX512F: AVX-512 foundation instructions = true
      AVX512PF: prefetch instructions          = true
      AVX: advanced vector extensions         = true
         XCR0 supported: AVX-512 Hi16_ZMM     = true
         XCR0 supported: AVX-512 opmask       = true
         XCR0 supported: AVX-512 ZMM_Hi256    = true
         XCR0 supported: AVX state            = true
      AVX512_4FMAPS: multiply acc single prec  = false
      AVX512_4VNNIW: neural network instrs     = false
      AVX512_BITALG: bit count/shiffle         = false
      AVX512BW: byte & word instructions       = false
      AVX512DQ: double & quadword instructions = false
   AVX-512 Hi16_ZMM features (0xd/7):
      AVX-512 Hi16_ZMM save state byte offset  = 0x00000680 (1664)
      AVX-512 Hi16_ZMM save state byte size    = 0x00000400 (1024)
      AVX512IFMA: fused multiply add           = false
   AVX-512 opmask features (0xd/5):
      AVX-512 opmask save state byte offset    = 0x00000440 (1088)
      AVX-512 opmask save state byte size      = 0x00000040 (64)
      AVX512_VBMI2: byte VPCOMPRESS, VPEXPAND  = false
      AVX512VBMI: vector byte manipulation     = false
      AVX512VL: vector length                  = false
      AVX512_VNNI: neural network instructions = false
      AVX512_VP2INTERSECT: intersect mask regs = false
      AVX512: VPOPCNTDQ instruction            = false
   AVX-512 ZMM_Hi256 features (0xd/6):
      AVX-512 ZMM_Hi256 save state byte offset = 0x00000480 (1152)
      AVX-512 ZMM_Hi256 save state byte size   = 0x00000200 (512)
   AVX/YMM features (0xd/2):
      AVX/YMM save state byte offset           = 0x00000240 (576)
      AVX/YMM save state byte size             = 0x00000100 (256)
